{
  "acceptance_eligible": false,
  "artifact_id": "qualification-fixture-001",
  "authoritativeness": "non_authoritative",
  "blockers": [],
  "claim_boundary": "Proves only fixture contract behavior.",
  "created_at": "2026-08-08T00:00:00Z",
  "digest": "sha256:2e6908df532b6f63325e4111c652e6a3f8710cec3394e4444c3557a1cafb93e9",
  "evidence_class": "fixture",
  "input_artifact_digests": [
    "sha256:aaaaaaaaaaaaaaaaaaaaaaaaaaaaaaaaaaaaaaaaaaaaaaaaaaaaaaaaaaaaaaaa"
  ],
  "primary_blocker": null,
  "producer": "diagnosing-bugs/qualification-artifact-validator",
  "producer_version": "1.0.0",
  "resume_point": null,
  "schema_version": "qualification-artifact-envelope/v1",
  "status": "passed",
  "subject_identity": {
    "capability_policy": {
      "digest": "sha256:1111111111111111111111111111111111111111111111111111111111111111",
      "policy_id": "fixture-policy",
      "version": "v1"
    },
    "hardware": {
      "generation": "fixture-generation",
      "topology_digest": "sha256:2222222222222222222222222222222222222222222222222222222222222222"
    },
    "installed_package": {
      "digest": "sha256:abababababababababababababababababababababababababababababababab",
      "name": "vllm",
      "path": "/opt/venv/lib/python3.10/site-packages/vllm",
      "version": "0.1.0"
    },
    "image": {
      "digest": "sha256:3333333333333333333333333333333333333333333333333333333333333333",
      "image_id": "fixture-image"
    },
    "model": {
      "digest": "sha256:4444444444444444444444444444444444444444444444444444444444444444",
      "model_id": "fixture-model",
      "revision": null
    },
    "native_binary": {
      "digest": "sha256:5555555555555555555555555555555555555555555555555555555555555555"
    },
    "driver": {
      "digest": "sha256:cdcdcdcdcdcdcdcdcdcdcdcdcdcdcdcdcdcdcdcdcdcdcdcdcdcdcdcdcdcdcdcd",
      "name": "fixture-driver",
      "version": "1.0"
    },
    "processor": null,
    "runtime": {
      "digest": "sha256:6666666666666666666666666666666666666666666666666666666666666666",
      "name": "fixture-runtime",
      "version": "1.0"
    },
    "source": {
      "dirty": false,
      "kind": "git",
      "repository": "https://example.invalid/vllm.git",
      "revision": "0123456789abcdef0123456789abcdef01234567",
      "snapshot_digest": null
    },
    "tokenizer": {
      "digest": "sha256:7777777777777777777777777777777777777777777777777777777777777777",
      "revision": null
    },
    "toolchain": {
      "digest": "sha256:8888888888888888888888888888888888888888888888888888888888888888",
      "name": "fixture-toolchain",
      "version": "1.0"
    },
    "workload": {
      "digest": "sha256:9999999999999999999999999999999999999999999999999999999999999999"
    }
  },
  "unverified_scope": [
    "real hardware behavior"
  ]
}
